번호,주제분류,문화시설명,문화시설주소,위도,경도,전화번호,팩스번호,홈페이지,관람시간,관람료,휴관일,개관일자,객석수,대표이미지,기타사항,시설소개,무료구분,지하철,버스정거장,YELLOW,GREEN,BLUE,RED,공항버스
10.0,문화원,주한독일문화원,서울특별시 용산구 소월로 132,37.55071315,126.9827115,02-2021-2800,,http://www.goethe.de/ins/kr/seo/deindex.htm,09:00 ? 18:00,,"토요일, 공휴일",,,https://culture.seoul.go.kr/cmmn/file/getImage.do?atchFileId=2a25dc3699c84f7193c39ee559238a32&thumb=Y,■ 기    타 : 도서관 월~금요일 13:00~18:00,"<span style='font-size: 14pt;'>독일 문화원(괴테 인스티투트)는 해외에서의 독일어 보급과 지원, 국제 간의 문화교류 증진을 위한 공익 법인으로써 1959년 설립되었다. 독일 문화원의 주요 업무는 독일 문화를 한국에 널리 알리기 위한 음악, 영화, 미술, 문학, 춤, 학술 등 다양한 분야의 폭넓은 문화행사를 주관하고 후원하는 것이다. 도서관, 음악당, 어학강의실, 카페테리아 등 시설을 갖추고 있다. 독일유학상담도 할 수 있다.</span>",유료,,,,,,,
11.0,문화원,주한영국문화원,서울특별시 중구 서소문로11길 19,37.56378783,126.9720891,1522-5009,02 3702 0660,https://www.britishcouncil.kr/,,,공휴일,,,https://culture.seoul.go.kr/cmmn/file/getImage.do?atchFileId=fb3b5669fc51483ca1662aa7c6e006a6&thumb=Y,,"<span style='font-size: 12pt;'>영국문화원은 교육과 문화 교류를 위한 영국정부의 공식기관으로 1973년 개원하였으며, 오피스와 어학센터를 통하여 유학상담, 영어교육, 영국에 대한 각종 정보제공, 문화교류 등 다양한 서비스와 활동을 하고 있다. 특히 1999년 4월 엘리자베스 2세 영국여왕에 의하여 개관한 영국 센터는 영국에 관한 정보를 제공하는 원스톱 숍으로 영국에 관한 일반적인 정보를 비롯하여 영국의 교육, 시험, 관광, 비즈니스 등에 관한 다양한 참고 자료와 시설을 갖추고 있다.</span>",유료,,,,,,,
59.0,문화원,강북청소년문화정보도서관,서울특별시 강북구 삼양로54길 68,37.62308136,127.0215555,02-944-3140,944-3149,https://www.gblib.or.kr/youth/index.do,"평일 09:00~20:00, 주말 09:00~17:00",무료,"매월 둘째, 넷째 월요일, 정부지정 공휴일",2013. 6. 21 : 명칭 변경 개관,,https://culture.seoul.go.kr/cmmn/file/getImage.do?atchFileId=ATH_SPC_000000000000000000100775&thumb=Y,그동안 문화적 참여공간이 미흡했던 미아동 지역에 청소년은 물론 지역주민들의 학습과 정보의 요람 및 문화생활의 공간이 될『강북청소년문화정보도서관』이 오랜시간 노력과 준비 끝에 개관을 하게 되었습니다.   2001년 12월에 개관한 우리 『강북청소년문화정보도서관』은 강북구의 지역정보화 및 다양한 문화생활에 기여할 수 있도록 첨단 시설과 장비를 갖추고 여러분을 맞이하고 있습니다.  비록 그 규모에 있어 약간의 차이는 있겠으나 신개념 도서관에 어울리는 다양한 도서자료는 물론 고속인터넷이 가능한 전자정보실 등에서 지식정보화 시대에 필요한 유용한 자료와 정보를 제공하고 있습니다.  강북청소년문화정보도서관은 첨단사회로 걸어가는 즈음에서 여러 지역주민들 모두가 평생 학습과 문화생활 참여의 공간으로 가깝게 다가갈 수 있도록 지속적으로 발전시켜 나갈 것입니다.  아울러 향기로운 독서문화와 새로운 배움의 열정을 가진 청소년 및 구민 여러분을 『강북청소년문화정보도서관』에서 더욱 많이 뵙기를 간절히 바라며 계속해서 애정 어린 관심과 끊임없이 많은 이용있으시기 바랍니다.,"<h5><span style='font-size: 12px;'>1층 : 모두열람실 평일 09:00~18:00 주말(토일요일) 09:00~17:00</span></h5> <p><b>2층 자료열람실&nbsp;평일 09:00~18:00 주말(토일요일) 09:00~17:00</b></p> <p>&nbsp; - 이용대상: 영유아, 청소년 및 일반인</p> <p>&nbsp; - 이용방법: 개가제</p> <p>&nbsp; - 소장자료: 영유아, 청소년 및 일반인 대상 전주제 자료 및 연속간행물, 신문 등</p><p><br></p><p><b>3층 전자정보실&nbsp;평일 09:00~20:00 주말(토일요일) 09:00~17:00</b></p><p><b><br></b></p><p><b>4층 일반열람실</b>&nbsp;<b>07:00 ~ 22:00</b></p> <p>&nbsp; - 이용방법: 지정좌석제 운영, 일반열람실 앞에서 입실증 발급, 퇴실시 반드시 퇴실 처리</p><p><br></p><p><br></p><article><p>  <br><br>  <br>  <br>  </p></article>",무료,,,,,,,
61.0,문화원,종로문화원,서울특별시 종로구 율곡로5 (사간동 122-4),37.5761054,126.9803283,02-2148-4087-8,02-731-0791,http://jongno.kccf.or.kr,,,정보없음,,,https://culture.seoul.go.kr/cmmn/file/getImage.do?atchFileId=7e74ff794568405eaad8bc8caef134f1&thumb=Y,,"<div><span style='font-size: 12pt;'>[문화원 현황]</span></div><div><span style='font-size: 12pt;'>종로문화원은 지역사회의 정신문화계도 및 문화진흥을 목적으로 하는 특수법인단체로 지역문화를 발전시키기 위해 운영되고 있습니다. 또한 3?1 만세의 날 거리축제, 종로전국청소년국악경연대회, 어르신문화프로그램, 월간 종로문화 발간, 향토사료집 발간, 종로문화대학, 제1,2차 지방문화탐방, 종로이야기강좌 등의 다양한 문화행사를 진행하고 있습니다.</span></div><div><span style='font-size: 12px;'><br></span></div><div><span style='font-size: 12pt;'>[설립목적]</span></div><div><span style='font-size: 12pt;'>지역고유문화의 계발?보급?보존?전승 및 선양</span></div><div><span style='font-size: 12pt;'>향토사의 발굴?조사?연구 및 사료의 수집, 보존</span></div><div><span style='font-size: 12pt;'>지역문화 행사의 개최</span></div><div><span style='font-size: 12pt;'>문화에 관한 자료의 수집?보존 및 보급</span></div><div><span style='font-size: 12pt;'>지역 전통문화의 국내?외 교류</span></div><div><span style='font-size: 12pt;'>지역 문화에 대한 사회교육활동</span></div><div><span style='font-size: 12pt;'>지역 환경보존 등 지역사회 발전을 위한 문화활동</span></div><div><span style='font-size: 12pt;'>지역 문화의 창달을 위한 사업</span></div><div><span style='font-size: 12pt;'>기타 지역문화 발전에 기여할 수 있는 사업？</span></div>",무료,,,,,,,
86.0,문화원,영등포문화원,서울특별시 영등포구 신길로 275,37.51612662,126.9121264,02-846-0155~6,02-846-0157,http://www.ydpcc.co.kr/,,,정보없음,,,https://culture.seoul.go.kr/cmmn/file/getImage.do?atchFileId=3ca55adbeb2c4f54a7e7fbc0639c1e6a&thumb=Y,,"<span style='font-size: 14pt;'>1층</span><br><span style='font-size: 14pt;'>   &nbsp;- 전시실 : 회원여러분이 만든 작품들을 전시하는 공간입니다.</span><br><span style='font-size: 14pt;'>   &nbsp;- 다목적 강당 : 특별강의 , 기획강의 등 다양하게 사용되는 강당입니다.</span><br>   <br><span style='font-size: 14pt;'>   2층</span><br><span style='font-size: 14pt;'>   &nbsp;- 제5강의실, 제6강의실, 예술인 사랑방, 문화정보센터, 영상실, 실습실(A), 실습실(B)</span><br><span style='font-size: 14pt;'>   &nbsp;&nbsp;&nbsp; 휴게실, 문화원사무국, 원장실, 부원장실</span><br>   <br><span style='font-size: 14pt;'>   3층</span><br><span style='font-size: 14pt;'>   &nbsp; - 제1강의실, 제2강의실, 제3강의실(미술, 서예교실), 휴게실, 다목적실, 소강당</span>",유료,,,,,,,
123.0,문화원,잠실종합운동장,서울특별시 송파구 올림픽로 25,37.51419412,127.073115,02-2240-8801,,https://stadium.seoul.go.kr/reserve/jamsil,,,변동,,,https://culture.seoul.go.kr/cmmn/file/getImage.do?atchFileId=ATH_SPC_000000000000000000100258&thumb=Y,,"<div>잠실종합운동장은 서울의 중심부에서 남쪽으로 약 13km 떨어진 송파구 잠실동에 위치하고 있으며, 운동장을 중심으로 남쪽길 건너편에 아시아선수촌아파트와 공원이, 그리고 동쪽으로 잠실아파트 대단지와 북쪽으로 한강과 탄천을 인접하고 있으며, 동남쪽 3.5km지점에는 올림픽 공원이 자리잡고 있습니다.<br><br>지하철 2호선과 9호선이 통과하고 있는 강남의 교통요지로서 총부지 402,816㎡에 올림픽주경기장, 야구장, 제1수영장, 제2수영장, 실내체육관 등 대형경기장과 그 외 잠실보조경기장을 비롯한 생활체육시설과 서울시교육청에서 관리?운영하고 있는 학생실내체육관이 있으며, 파크골프장, 풋살경기장 등이 있는 넓은 체육공원 등 다양한 경기장 시설이 있습니다.<br><br>경기장의 건설은 1976년부터 착공하여 1984년 9월까지 완공되었으며, 총 공사비는 1,025억원이 소요되었습니다. 특히 올림픽주경기장은 제10회 아시아 경기대회와 제24회 서울 올림픽대회의 개?폐회식과 육상, 축구 등을 치룬 바 있는 역사적 의미를 갖는 경기장으로서 외국의 많은 관광객이 방문하고 있는 관광명소가 되었으며, 최근에는 국제적인 축구경기는 물론, 각종 콘서트를 비롯한 대형경기 및 행사가 개최되고 있습니다.</div>",유료,,,,,,,
125.0,문화원,도봉문화원,서울특별시 도봉구 도봉로 552,37.65419928,127.0388705,02-905-4026,02-908-6020,http://www.dobong.or.kr/main/index.php,,,정보없음,1994.08.20,,https://culture.seoul.go.kr/cmmn/file/getImage.do?atchFileId=ATH_SPC_000000000000000000100779&thumb=Y,,"<div style='text-align: center;' align='center'><span style='font-size: 14pt;'>도봉문화원은 향토문화를 계승 보존 발전시키고 지역주민의 문화적 삶의 질 향상을 위하여 노력하고 있으며 지방문화원진흥법(1994. 1. 7)에 의하여 설립된 비영리특수법인</span></div><div style='text-align: center;' align='center'><span style='font-size: 14pt;'>으로 1994년 8월 문화관광부로부터 인가를 받았습니다 주요사업으로는 지역고유문화의 계발 보급 전승 및 선양, 향토사의 조사연구 및 사료 수집 보존, 지역문화행사의&nbsp;</span></div><div style='text-align: center;' align='center'><span style='font-size: 14pt;'>개최, 지역전통문화의 국내외 교류, 지역문화에 대한 사회교육활동, 지역환경보존등 지역사회 발전을 위한 문화활동, 청소년 문화 및 복지사업, 기타 지역문화발전에 기여할</span></div><div style='text-align: center;' align='center'><span style='font-size: 14pt;'>수 있는 사업 등을 주민과 함께 하고 있습니다</span></div>",유료,,,,,,,
