번호,주제분류,문화시설명,문화시설주소,위도,경도,전화번호,팩스번호,홈페이지,관람시간,관람료,휴관일,개관일자,객석수,대표이미지,기타사항,시설소개,무료구분,지하철,버스정거장,YELLOW,GREEN,BLUE,RED,공항버스
207.0,문화원,이마트은평점,서울특별시 은평구 은평로 111,37.60035755,126.920192,02-380-1234,,,,,,,,https://culture.seoul.go.kr/cmmn/file/getImage.do?atchFileId=ATH_SPC_000000000000000000101237&thumb=Y,,,,,,,,,,
261.0,문화원,국기원,서울 강남구 테헤란로7길 32,37.5019899,127.03031,02-567-1058,02-552-3025,http://www.kukkiwon.or.kr,,,"일요일, 공휴일",,,https://culture.seoul.go.kr/cmmn/file/getImage.do?atchFileId=ATH_SPC_000000000000000000100046&thumb=Y,■ 기    타 : 세계태권도연맹 : 02-557-5446<br> [주요대회] 전국종별선수권대회 : 매년 3월 대한태권도협회장기대회 : 매년 5월 대통령기전국단체대항대회 : 매년6월 전국체육대회 : 매년 10월 태권도한마당 : 매년 11월,"<div style='text-align: center;' align='center'><span style='font-size: 14pt;'>삼국시대의 택견, 수박에서 기원한 민속무예 태권도는 본격적인 현대화과정을 겪은 지 불과 30여 년만에 전세계적으로 가장 널리 보급된 동양무술로 자리잡았다.&nbsp;</span></div><div style='text-align: center;' align='center'><span style='font-size: 14pt;'>1972년 태권도센터로 시작해 1973년 세계태권도연맹이 창설되면서 세계태권도의 본산 노릇을 시작한 국기원은 재단법인 국기원이 경영하는 태권도 중앙도장 겸&nbsp;</span></div><div style='text-align: center;' align='center'><span style='font-size: 14pt;'>시험장으로 강남구 역삼동 산 76번지에 자리잡고 있다. 태권도가 2000년 시드니올림픽대회에서 정식경기종목으로 채택된 이후로 태권도 종주국에서 한 수 배워</span></div><div style='text-align: center;' align='center'><span style='font-size: 14pt;'>보겠다는 각오로 방한하는 외국인들이 최근 들어 늘어나면 이제 국기원은 태권도의 명실상부한 태권도의 메카로 자리잡게 됐다.</span></div>",유료,,,,,,,
275.0,문화원,장충체육관,서울특별시 중구 동호로 241,37.55813132,127.0067906,02-2128-2800,,https://www.sisul.or.kr/open_content/jangchung/,,,일정변동,,,https://culture.seoul.go.kr/cmmn/file/getImage.do?atchFileId=ATH_SPC_000000000000000000100522&thumb=Y,,"<p>1963년 2월 1일에 개장한 국내 최초의 실내 체육관으로 서울 중구 장충동에 위치하고 있으며 지하 2층, 지상 3층, 연면적 11,392제곱미터, 관람석은 4,507석임</p><p>주요시설로 주체육관과 보조체육관, 다목적실이 있음</p><p>장충체육관은 남산 동북쪽 기슭에 있는 장충단 공원에 위치하고 있으며, 씨름, 농구, 배구 경기가 주로 열리고 1988년 올림픽 대회시 유도 태권도 장으로 주로 사용되었다.</p>",유료,,,,,,,
278.0,문화원,노원문화원,서울특별시 노원구 동일로197길 24,37.62879899,127.0698009,02-6380-0022~3,02-938-1247,https://www.nwcc.or.kr/main/index.php,,,"일요일, 법정공휴일",,,https://culture.seoul.go.kr/cmmn/file/getImage.do?atchFileId=7d99e66703844bceaf2c1174164e2cc2&thumb=Y,,"<div style='text-align: center;' align='center'><span style='font-size: 14pt;'>문화예술활동과 향토사 조사, 연구사업, 문화학교 등을 통하여 지역주민들이 더욱 풍요로운 문화적 삶을 누릴 수 있도록 노력하는 비영리 특수법인입니다.&nbsp;</span></div><div style='text-align: center;' align='center'><span style='font-size: 14pt;'>그동안 노원구사랑방이야기, 1,2집과 노원으로의 역사여행, 노원의 문화유적을 찾아서, 노원의 역사와 문화, 마들이야기 등의 향토사료집과 영상자료를&nbsp;</span></div><div style='text-align: center;' align='center'><span style='font-size: 14pt;'>제작하여 배포하였고, 2000년 11월부터 노원문화 라는 지역문화 정보지를 매년 발간하고 있습니다. 앞으로도 지역주민의 다양한 문화적 요구에 부응할&nbsp;</span></div><div style='text-align: center;' align='center'><span style='font-size: 14pt;'>수 있도록 최선을 다하는 문화원이 되겠습니다.</span></div>",무료,,,,,,,
344.0,문화원,서초문화원,서울특별시 서초구 강남대로 201 서초문화예술회관 2층 서초문화원,37.4818291,127.0359583,02-2155-8607,,http://socc.or.kr/,,,"주말, 공휴일",,,https://culture.seoul.go.kr/cmmn/file/getImage.do?atchFileId=ATH_SPC_000000000000000000101402&thumb=Y,,"<p><span class='itemfont col'><font color='#414141' face='돋움'>서초구민과&nbsp;문화예술이&nbsp;함께&nbsp;교감하는&nbsp;새로운&nbsp;문화공간,서초문화원입니다.&nbsp;</font></span></p><p><span class='itemfont col'><font color='#414141' face='돋움'>http://socc.or.kr&nbsp;<br>  카카오톡@서초문화원&nbsp;<br>  페이스북@socc.or.kr&nbsp;<br>  인스타그램@s_c_c_&nbsp;</font></span></p>",무료,,,,,,,
349.0,문화원,몽골 울란바타르 문화진흥원,서울특별시 광진구 광장로 1,37.54554942,127.0982047,02-446-4199,,http://www.mongolcenter.org/,,,정보없음,,,https://culture.seoul.go.kr/cmmn/file/getImage.do?atchFileId=6bb5786d2cbb4362ac024f20a4c7b059&thumb=Y,■ 프로그램 1. 몽골어학당 2. 몽골음악감상 및 영화상영 3. 한국나담축제 4. 몽골도서 및 신문 5. 몽골그림과 사진 6. 몽골문화한마당,"<div style='text-align: center;' align='center'><span style='font-size: 14pt;'>몽골의 수도인 울란바타르시의 문화원 설립 요청이 있었고, 한국의 서울시와 몽골의 수도 울란바타르시의 양시의 지원아래 2001년 6월 4일에 개원.</span></div>",유료,,,,,,,
353.0,문화원,구립마포청소년문화의집,서울시 마포구 상암산로 1길 67 마포청소년문화의집,37.5804167,126.884,02-303-1380~1,02-303-5800,http://www.mycc.or.kr,,,정보없음,2010.03.01,,https://culture.seoul.go.kr/cmmn/file/getImage.do?atchFileId=ATH_SPC_000000000000000000100796&thumb=Y,,"<br>  ■ 이용대상&nbsp;<br>  &nbsp; - 청소년 우선 이용을 원칙으로 하며, 지역주민은 탄력적 지정 시간에만 이용이 가능합니다.<br>  &nbsp; - 마포청소년문화의집 운영목적(기준)에 맞지 않을 때에는 이용이 제한됩니다.<br>  <br>  ■ 운영시간<br>  &nbsp; - 평일 : 07:00 ~ 22:00<br>  &nbsp; - 토요일 : 08:00 ~ 22:00<br>  &nbsp; - 일요일 : 09:00 ~ 21:00<br>  &nbsp; - 휴관일 : 신정, 설연휴, 추선연휴, 선거일 및 문회의집 지정일<br>  <br>  ■ 이용방법<br>  &nbsp; - 개인은 시설별 예약에 따라 이용합니다.<br>  &nbsp; - 프로그램실, 강당, 다목적체육관은 사전예약 후 이용가능합니다.<br>  &nbsp; - 방과후 교실은 연간사업으로 운영합니다.<br>  &nbsp; - 상담실은 업무상황에 따라 예약 가능하며, 당일 방문 등 병행 운영합니다.<br>  <br>  <br>",무료,,,,,,,
356.0,문화원,마포문화원,서울특별시 마포구 백범로 227,37.54223042,126.9554912,02-312-1100,,http://www.mapocc.or.kr/,,,법정공휴일,,,https://culture.seoul.go.kr/cmmn/file/getImage.do?atchFileId=ATH_SPC_000000000000000000101376&thumb=Y,,<div style='text-align: center;' align='center'><span style='font-size: 14pt;'>마포문화원은 지방문화원법('94.1.7 법령 제 4718호)의 규정에 근거하여 마포지역의 문화진흥을 위해 설립된 비영리 특수법인이다.&nbsp;</span></div><div style='text-align: center;' align='center'><span style='font-size: 14pt;'>문화발전을 위한 다양한 사업을 진행하고 있다.</span></div>,무료,,,,,,,
403.0,문화원,주한이탈리아문화원,서울특별시 용산구 한남대로 98,37.53716704,127.0055166,02-796-0634,,http://www.iicseoul.esteri.it/,수요일 14:00 ? 17:00도서관 : 월~금요일 09:00~18:00 (점심시간제외),,정보없음,,,https://culture.seoul.go.kr/cmmn/file/getImage.do?atchFileId=ATH_SPC_000000000000000000100303&thumb=Y,,"<span style='font-size: 14pt;'>한남동 이탈리아 대사관과 함께 있는 문화원은 양국의 활발한 문화교류와 인적교류를 위해 설립되었다. 문화원의 활동은 크게 도서관 운영과 유학 상담, 어학 강좌 그리고 다양한 문화행사의 개최 및 후원이다. 문화원을 이용하기 위해서 사전 약속이 있어야하며 정해진 요일에만 방문이 가능하다.</span>",유료,,,,,,,
404.0,문화원,주한일본대사관 공보문화원,서울특별시 종로구 율곡로 6,37.57545386,126.9797758,02-765-3011,,http://www.kr.emb-japan.go.jp/cult/cul_guide_hist.htm,09:30~17:00,,"매주 토.일요일 및 매주 제1 월요일, 공휴일, 연말연시 휴관",,,https://culture.seoul.go.kr/cmmn/file/getImage.do?atchFileId=ATH_SPC_000000000000000000100463&thumb=Y,,"<span style='font-size: 12pt;'>1971년 문을 연 일본문화원은 한?일 양국의 활발한 문화교류와 이해를 위하여 일본에 대한 다양한 정보를 제공하고 22,000여권의 장서를 갖춘 도서실, 실크갤러리, 뉴센츄리홀과 같은 문화공간을 갖추고 있다. 일본어 강좌, 유학상당, 인적교류 등 다양한 사업을 추진하고 있다.</span>",유료,,,,,,,
405.0,문화원,주한중국문화원,서울특별시 종로구 사직로8길 23-1,37.57460392,126.971348,02-733-8307,,http://www.cccseoul.org/,화-토요일 09:00~17:00(점심시간 12:00~13:00),,정보없음,,,https://culture.seoul.go.kr/cmmn/file/getImage.do?atchFileId=ATH_SPC_000000000000000000100367&thumb=Y,,<span style='font-size: 12pt;'>한국 각계 인사를 대상으로 현대 중국의 발전상과 중국문화를 정확히 소개하여 중국을 이해하려는 한국인들에게 정확한 정보서비스를 제공합니다. 중한 양국의 문화교류를 한층 활성화 시켜 여러 형태의 문화활동 개최와 중국어 뿐만이 아닌 각종 중국에 관한 지식 강좌들을 열어 양국 국민들의 이해와 친선을 도모합니다. 중한 양국 문화에 관한 협력을 한 단계 더 높여 서로 협력하여 문화교류를 하는 각계인사들에게 교류와 친선의 장을 제공합니다.</span>,유료,,,,,,,
411.0,문화원,반포잠원교육지원센터,서울특별시 서초구 사평대로 273,37.50509404,127.0133786,02-545-4991,,http://www.dcmcenter.com,,,정보없음,,,https://culture.seoul.go.kr/cmmn/file/getImage.do?atchFileId=a61d346ee4d548afb5834275d944efa2&thumb=Y,,"<div class='map_box' style='font-family:;' 51);='' 51,='' rgb(51,='' 30px;='' sans-serif;='' 16px;'='' gothic',='' malgun=''><div class='map_s' style='color: rgb(50, 118, 202); font-size: 18px; font-weight: bold;'><div class='map_t' style='color: rgb(68, 68, 68); font-size: 20px; margin-bottom: 15px;'><ul><li>반포잠원교육지원센터 소개</li></ul><span class='icon-bookmark' style='line-height: 1; letter-spacing: 0px; font-weight: normal; speak: none; font-variant-numeric: normal; font-variant-east-asian: normal;' icomoon='' antialiased;='' !important;'='' liga';=''></span></div></div><div class='map_s' style='color: rgb(50, 118, 202); font-size: 18px; font-weight: bold;'>? 학교에서 경험할 수 없는</div><p style='margin: 0px;'>뮤지컬, 연극, 영화 DCM 특화 프로그램운영</p><p style='margin: 0px;'><br></p></div><div class='map_box' style='font-family:;' 51);='' 51,='' rgb(51,='' 30px;='' sans-serif;='' 16px;'='' gothic',='' malgun=''><div class='map_s' style='color: rgb(50, 118, 202); font-size: 18px; font-weight: bold;'>? 서초 청소년 Art School</div><p style='margin: 0px;'>서초 청소년들의 꿈과 재능을 발견하는 DCM센터</p><p style='margin: 0px;'><br></p></div><div class='map_box' style='font-family:;' 51);='' 51,='' rgb(51,='' 30px;='' sans-serif;='' 16px;'='' gothic',='' malgun=''><div class='map_s' style='color: rgb(50, 118, 202); font-size: 18px; font-weight: bold;'>? 서초구에서 지원하는 청소년 문화예술 Free Art Education</div><p style='margin: 0px;'>자유학기제 시행에 맞춰 서초구 문화예술교육기관인 DCM센터는 모든 과정을 무상으로 운영합니다.</p><p style='margin: 0px;'><br></p></div><div class='map_box' style='font-family:;' 51);='' 51,='' rgb(51,='' 30px;='' sans-serif;='' 16px;'='' gothic',='' malgun=''><div class='map_s' style='color: rgb(50, 118, 202); font-size: 18px; font-weight: bold;'>? 학교(학급) 단체예약<br>  </div><p style='margin: 0px;'><b>학기 중 DCM단기체험</b><br>  다양한 문화예술 체험(연극, 영화촬영&amp;편집, 뮤지컬)으로 창의및 감성?인성교육 오전/오후 3차시 또는 1일 체험과정 운영</p><p style='margin: 0px;'><br></p></div><div class='map_box' style='font-family:;' 51);='' 51,='' rgb(51,='' 30px;='' sans-serif;='' 16px;'='' gothic',='' malgun=''><div class='map_s' style='color: rgb(50, 118, 202); font-size: 18px; font-weight: bold;'>? 개별접수</div><p style='margin: 0px;'><b>방과 후 DCM단기체험</b><br>  개인 및 동아리 단위 대상 다채로운 문화?예술 프로그램을 운영하여 결과물을 공연, 발표 및 전시와 연계<br>  </p><p style='margin: 0px;'><b>주말 DCM토요활동</b><br>  개인그룹 및 학교동아리 활성화 과정 동아리 코칭, 공연&amp;전시체험 등 단기 집중<br>  </p><p style='margin: 0px;'><b>방학 DCM방학캠프</b><br>  여름/ 겨울 방학 10일(2주)통학형 단기집중 과정 학생주도 종합예술기반 창의융합 (Art Collaboration)<br>  <br>  ※모든 과정은 1개월 사전예약제로 운영됨</p><p style='margin: 0px;'><br>  </p></div><div class='map_box' style='font-family:;' 51);='' 51,='' rgb(51,='' 30px;='' sans-serif;='' 16px;'='' gothic',='' malgun=''><div class='map_t' style='color: rgb(68, 68, 68); font-size: 20px; font-weight: bold; margin-bottom: 15px;'><ul><li>운영시간</li></ul><span class='icon-bookmark' style='line-height: 1; letter-spacing: 0px; font-weight: normal; speak: none; font-variant-numeric: normal; font-variant-east-asian: normal;' icomoon='' antialiased;='' !important;'='' liga';=''></span></div><p style='margin: 0px;'>화요일-금요일 : 10:00-19:00<br>  토요일 : 09:00-18:00</p><p style='margin: 0px;'><br></p></div><div class='map_box' style='font-family:;' 51);='' 51,='' rgb(51,='' 30px;='' sans-serif;='' 16px;'='' gothic',='' malgun=''><div class='map_t' style='color: rgb(68, 68, 68); font-size: 20px; font-weight: bold; margin-bottom: 15px;'><ul><li>&nbsp;교육 대상</li></ul><span class='icon-bookmark' style='line-height: 1; letter-spacing: 0px; font-weight: normal; speak: none; font-variant-numeric: normal; font-variant-east-asian: normal;' icomoon='' antialiased;='' !important;'='' liga';=''></span></div><p style='margin: 0px;'>DCM 프로그램 : 초등학교 4학년 - 중학교 3학년<br>  Supr-Kids 영어프로그램 : 5세 - 초등학교 6학년</p></div>",무료,,,,,,,
452.0,문화원,서울월드컵경기장,서울특별시 마포구 월드컵로 240,37.56820649,126.8971068,02-2128-2973,,http://www.sisul.or.kr/open_content/worldcup/,,,변동,,,https://culture.seoul.go.kr/cmmn/file/getImage.do?atchFileId=ATH_SPC_000000000000000000100172&thumb=Y,"■ 기    타 : ※ 서울월드컵경기장 건설홍보관 - 위 치 : 마포구 상암동 월드컵경기장 스탠드 하부2층(서측) - 규 모 : 670㎡(203평) - 설치시설 : 상황실, 전시실, 기념품 판매소 등 - 운영시간 ㆍ평일, 토요일 및 일요일 : 09:00~18:00 ㆍ동절기 : 09:00~17:00 - 문의전화 : 02-3707-9851?4","경기장을 위에서 내려다본 모습은 하나의 커다란 사각 방패연으로, 승리를 향한 희망을 띄우고 월드컵을 통해 우리나라의 이미지와 문화를 띄우며, 새로운 세기를 맞아 통일과 인류평화에 대한 희망을 띄우는 이미지를 표현한 것이다. 또한 주변의 마포나루와 황포돛배의 상징성을 살려 경기장의 이미지를 황포돛배가 모여있는 형상으로 구현한 것이다.   ※ 전통적인 소반과 풍요로움을 상징하는 팔각모반의 겹침  서울월드컵경기장은 선수, 관중, 전세계인의 시선을 하나로 담는 무대로서 여기에 우리민족의 문화와 역사, 희망을 담아내고 우리나라 전통 소반과 풍요로움을 상징하는 팔각모반(과일을 담는 접시)을 겹쳐놓아 맞아하는 이의 정성스러움을 나타낸 것이다.   ※ 전통 건축의 유연한 곡선미  지붕재료로 사용된 막구조에 의해 표현될 수 있는 자연스러운 곡선을 이용해 첨단의 기술로 한국의 전통적인 지붕과 처마선을 표현한 것이다.",유료,,,,,,,
484.0,문화원,용산문화원,서울특별시 용산구 효창원로8길 28,37.53342496,126.95186,02-703-0052~3,02-703-0366,http://yongsan.kccf.or.kr,공연에 따라 다름,,"매주 토,일요일",1997.12.09,공연장 1개 총 300석 규모,https://culture.seoul.go.kr/cmmn/file/getImage.do?atchFileId=7284e48f2c4044aa94be0ef64746af98&thumb=Y,,"<span style='font-size: 14pt;'>1997년 12월에 개관한 용산문화원은 용산구를 사업구역으로 하고 서울특별시장의 인가를 받아 설립된 비영리 특별법인으로 강의실과,무용실,소강당에서 약50여개의 문화강좌가 연간 진행중에 있으며, 대강당에서 각종 문화행사 및 시상식 등이 이루어지고 있는 연면적 1,286.1㎡규모의 지역문화시설 공간임.</span>",유료,,,,,,,
540.0,문화원,동작문화원,서울특별시 동작구 장승배기로10길 42,37.50444553,126.9410884,02-822-8500,02-822-5003,www.dongjaktv.net,,0,"토,일,공휴일",,,https://culture.seoul.go.kr/cmmn/file/getImage.do?atchFileId=20bb7e381cef4f5eae8616c6c343aef7&thumb=Y,,"<p><span style='font-size: 12pt;'>저희 동작문화원은 1998년에 개원하여</span></p><p><span style='font-size: 16px;'>상도동에 본원과 사당동에 분원을 두어</span></p><p><span style='font-size: 12pt;'>구민분들을 대상으로 향토문화계발, 문화예술활동, 문화시민교육,</span></p><p><span style='font-size: 12pt;'>문화교류사업, 문화학교운영 등을 주로 하고 있습니다.</span></p><p><span style='font-size: 12pt;'>다양한 사업을 통해 동작구 문화의 중심지로 자리매김하고</span></p><p><span style='font-size: 12pt;'>보다 많은 분들이 문화혜택을 받으실 수 있도록</span></p><p><span style='font-size: 12pt;'>열려있고&nbsp;</span><span style='font-size: 12pt;'>항상 노력하고 있는&nbsp;</span><span style='font-size: 12pt;'>문화원입니다.</span></p><p><span style='font-size: 12pt;'><br></span></p>",무료,,,,,,,
551.0,문화원,도봉구청,서울특별시 도봉구 마들로 656,37.66871613,127.0471314,02-3494-6474,,http://dbfac.or.kr/front/dbgmc/gmcIntro.do,,0,"1월 1일, 설날, 추석, 기타 공휴일 및 도봉구청장이 운영상 휴관일 필요하다고 정하는 날 (휴관일 10일전 공지)",,,https://culture.seoul.go.kr/cmmn/file/getImage.do?atchFileId=241378e8b3164905827930e423b6c6ed&thumb=Y,,"<p><span style='background-color: rgb(255, 255, 255); color: rgb(26, 26, 26); font-family: HCRDotum, dotum, serif; font-size: 14px;'>도봉구민청은 주민을 위한 공간으로 회의, 세미나 등 자유롭게 이용할 수 있는 모임공간이자 다양한 활동을 펼칠 수 있는 공간입니다.</span></p><h4 class='conTit4' style='margin: 50px 5px 25px 0px; padding: 0px 0px 0px 35px; box-sizing: border-box; background: url(' ..='' images='' front='' sub='' h4_bg.png')='' left='' center='' no-repeat='' rgb(255,='' 255,='' 255);='' color:='' rgb(0,='' 25,='' 75);='' font-size:='' 24px;='' display:='' inline-block;='' font-family:='' hcrdotum,='' dotum,='' serif;='' font-style:='' normal;='' font-variant-ligatures:='' font-variant-caps:='' letter-spacing:='' orphans:='' 2;='' text-align:='' start;='' text-indent:='' 0px;='' text-transform:='' none;='' white-space:='' widows:='' word-spacing:='' -webkit-text-stroke-width:='' text-decoration-thickness:='' initial;='' text-decoration-style:='' text-decoration-color:='' initial;'=''></h4><p></p>",무료,,,,,,,
572.0,문화원,성북문화원,서울특별시 성북구 성북로4길 13-8 성북문화원,37.58969266,127.0057255,02-765-1611,,https://www.isbcc.or.kr/,,0,공휴일,,,https://culture.seoul.go.kr/cmmn/file/getImage.do?atchFileId=cda1a050a98d45ff8922302ea5f35dca&thumb=Y,,"<p><span style='font-family: NanumBarunGothic, sans-serif; font-size: 16px; text-align: justify; background-color: rgb(255, 255, 255);'>전통이 현재와 공존하며,</span><span style='font-family: NanumBarunGothic, sans-serif; font-size: 16px; text-align: justify; background-color: rgb(255, 255, 255);'>&nbsp;미래의 문화를 만들어 나가는 곳,</span><br style='box-sizing: border-box; transform: skew(-0.1deg); font-family: NanumBarunGothic, sans-serif; font-size: 16px; text-align: justify; background-color: rgb(255, 255, 255);'><span style='font-family: NanumBarunGothic, sans-serif; font-size: 16px; text-align: justify; background-color: rgb(255, 255, 255);'>성북 지역학의 중심지&nbsp;</span><span style='box-sizing: border-box; font-weight: bolder; text-shadow: rgb(51, 51, 51) 0px 0px; transform: skew(-0.1deg); font-family: NanumBarunGothic, sans-serif; font-size: 16px; text-align: justify; background-color: rgb(255, 255, 255);'>성북문화원</span><span style='font-family: NanumBarunGothic, sans-serif; font-size: 16px; text-align: justify; background-color: rgb(255, 255, 255);'>입니다.</span><br style='box-sizing: border-box; transform: skew(-0.1deg); font-family: NanumBarunGothic, sans-serif; font-size: 16px; text-align: justify; background-color: rgb(255, 255, 255);'></p>",무료,,,,,,,
599.0,문화원,드플로허,서울특별시 용산구 대사관로5길 34,37.53577818,127.0002756,02-790-5246,,http://blog.naver.com/deflore1,,0,"매주 화요일, 목요일",,,https://culture.seoul.go.kr/cmmn/file/getImage.do?atchFileId=95e8c5d7deb74590b759b6448d3f9442&thumb=Y,,"<div><span style='font-size: 12px;'>&lt;복합문화공간 - 드플로허 DeFlore&gt;</span></div><div><span style='font-size: 12px;'><br></span></div><div><span style='font-size: 12px;'>-층별안내: 3F갤러리, 2F카페, 1F빈티지샵(우니쿠)</span></div><div><span style='font-size: 12px;'>-위치: 6호선 이태원역과 한강진역 사이</span></div><div><span style='font-size: 12px;'>-운영취지: 여러 예술가들이 모여 들어 커피와 함께 상호교감의 장소가 되었던 파리의 한 카페에서 영감을 받아, 우리의 일상에서 예술작품을 소개하고 접하며, 대중에게 다가가는 복합문화공간이 되고자 합니다.</span></div><div><span style='font-size: 12px;'>전시 작가님들에게는 작품전 뿐만 아니라 인스퍼레이션을 충전할 수 있는 공간이 되고, 일반인들에게는 예술작품을 관람하고 예술 상식과 문화생활을 친숙하게 즐기며 힐링 티 타임과 함께 쉬어갈 수 있는 추억의 장소이고 싶습니다.</span></div><div><span style='font-size: 12px;'>회화, 사진, 영상, 설치미술, 패션, 텍스타일 등 관련 전시 뿐만 아니라 장르의 경계를 넘어 상호교감할 수 있는 작품전시! 환영합니다.</span></div><div><span style='font-size: 12px;'>전시작가님들을 위해서 아래층의 카페에서 오프닝 가능하며, 전시기간동안에는 관람하는 모든 분들께 음료할인쿠폰도 있으니 놓치지 마시구요~</span></div><div><span style='font-size: 12px;'>아래층의 카페는 인더스트리얼 빈티지 컨셉으로, 강렬한 레드 컬러의 시빌라 커피 머신과 포르테 원두, 반고흐가 즐겨 마셨다는 예멘모카마타리 등의 음료들이 여러분을 기다리고 있습니다. 그리고 “빈티지샵 우니쿠”가 입점하여 패션피플에게는 더욱 흥미로운 공간입니다</span></div><div><span style='font-size: 12px;'>활기넘치는 이태원한남동두 구경하시고, 복합문화공간 드플로허에서 유익한 추억의 시간도 만들어 가세요^^</span></div><div><span style='font-size: 12px;'>이 글을 읽으시는 모든 분들!!!</span></div><div><span style='font-size: 12px;'>건강하고 행복한 하루하루가 되시기를 바랍니다</span></div>",무료,,,,,,,
