번호,주제분류,문화시설명,문화시설주소,위도,경도,전화번호,팩스번호,홈페이지,관람시간,관람료,휴관일,개관일자,객석수,대표이미지,기타사항,시설소개,무료구분,지하철,버스정거장,YELLOW,GREEN,BLUE,RED,공항버스
686.0,문화원,이스라엘문화원,서울특별시 서초구 서초대로74길 23,37.49561193,127.027091,02-525-7301,,http://www.ilculture.or.kr/main.php,,,"매주 수요일, 토요일, 일요일, 국가공휴일",,,https://culture.seoul.go.kr/cmmn/file/getImage.do?atchFileId=e5b10b8f46014d90b24ba987ed6fc9eb&thumb=Y,"■ 문화원의 활동 심포지엄 및 세미나 (Symposium & Seminar) 전시회, 연주회, 영화, 축제 (Exhibitions, Concert, Film & Festivals) 히브리어강좌 (Hebrew Courses) 유대학 전문 도서관(Library for Jewish Studies) 이스라엘 문화탐방 (Exploring Israel) 및 기타","<div style='text-align: center;' align='center'><span style='font-size: 14pt;'>문화원은 현재 서울 강남 도심에 위치해 있으며, 이스라엘과 유대학 관련 전문서적을 구비한 전문도서관을 운영하고 있으며, 이미 이스라엘 사람이 직접 강의하는 히브리어 강</span></div><div style='text-align: center;' align='center'><span style='font-size: 14pt;'>좌가 개설되어 초급, 중급, 고급 과정이 진행 중이며, 국제심포지엄, 세미나, 각종 전시회, 연주회, 친선 공연, 하프 콩쿨 대회, 박람회 등을 이스라엘 대사관과 공동, 또는 단독으</span></div><div style='text-align: center;' align='center'><span style='font-size: 14pt;'>로 개최하여 한국 속에 이스라엘을 알리고, 한국과 이스라엘을 잇는 매개체 역할을 담당하고 있습니다. 이스라엘이 지형적으로는 작지만 전 세계에 큰 영향을 끼치듯이, 이스</span></div><div style='text-align: center;' align='center'><span style='font-size: 14pt;'>라엘 문화원도 이러한 이스라엘과 그 민족이 지닌 독특한 역량을 우리나라 사람들에게 친근하게 접근시켜, 두 나라가 갖고 있는 여러 유사성과 특징으로 두 민족이 서로 공유</span></div><div style='text-align: center;' align='center'><span style='font-size: 14pt;'>할 수 있는 만남의 장소가 될 것으로 기대해 봅니다.</span></div>",유료,,,,,,,
738.0,문화원,중랑문화원,"서울특별시 중랑구 면목로 238(면목동, 중랑구민회관 3층)",37.57395395,127.0851055,02-492-0066~7,02-2207-5761,https://www.ejnc.kr/,,,정보없음,,,https://culture.seoul.go.kr/cmmn/file/getImage.do?atchFileId=4e8daf76a6cd4a2790cc4c912c43b161&thumb=Y,,"<div style='text-align: left;' align='left'><span style='font-size: 12pt;'>중랑문화원은 중랑구청에서 3억원의 기금을 출연하고 우리 문화원 가족들이 IMF의 경제난에도 불구하고 십시일반으로 3억여원의 기금을 출연하여 6억여원의 자본금으로 지난 1998년 10월 13일에 구민의 관심속에 개원하였으며, 매년 기금확보를 통하여 2022년 현재 11억 4천 2백 7십만원의 기금을 확보하고 있습니다.</span></div><div style='text-align: left;' align='left'><span style='font-size: 12px;'><br></span></div><div style='text-align: left;' align='left'><span style='font-size: 12pt;'>중랑구민회관 3층에 원장실, 사무국 및 문화학교를 운영할 수 있는 강의실 및 생활체육실등 시설을 갖추고 있으며, 구민 누구나 이용할 수 있는 문화정보센터를 운영하고 있습니다.</span></div><div style='text-align: left;' align='left'><span style='font-size: 12px;'><br></span></div><div style='text-align: left;' align='left'><span style='font-size: 12pt;'>2006년 중랑향토문화해설사 양성교육을 통하여 초,중,고등학교에 지역역사문화탐방을 실시하여 어린이 및 청소년들에게 우리지역 향토역사에 대한 교육도 실시하고 있습니다. 조직으로는 원장 1명, 부원장 1명, 명예원장 1명, 고문 1명, 이사 17명, 2명의 감사가 있으며, 100여명의 특별회원과 일반회원을 확보하고 있습니다. 사무국에는 사무국장 1명과 직원 3명, 구청 파견 1명, 사회복무요원 1명이 근무하고 있습니다.</span></div><div style='text-align: left;' align='left'><span style='font-size: 12px;'><br></span></div><div style='text-align: left;' align='left'><span style='font-size: 12pt;'>중랑문화원은 시비, 구비 사업비와 기금이자 회원의 회비로 운영되며 우리 지역 고유문화의 발굴?보급을 위한 사업과 전통문화에 관련된 자료의 수집?보존 기타 지역문화발전에 기여할 수 있는 사업을 개발을 하고 있습니다.</span></div>",무료,,,,,,,
895.0,문화원,송파문화원,서울특별시 송파구 올림픽로 44,37.51068239,127.0759368,02-414-0354,02-414-0357,https://www.spcc.or.kr/index.asp,,,매주 일요일,,,https://culture.seoul.go.kr/cmmn/file/getImage.do?atchFileId=f3b0f83a2db04f0d9235bc786f109cd1&thumb=Y,,"<div><span style='font-size: 12pt;'>“과거와 현재 그리고 미래를 열어가는 송파문화원”</span></div><div><span style='font-size: 12px;'><br></span></div><div><span style='font-size: 12pt;'>우리 문화원은 전통문화의 계승 및 발전을 위해 송파구 등 유관기관과 함께 적극 노력하고 있으며, 지역문화예술의 수준 향상을 위해 송파구와 공동으로 한성백제문화제, 벚꽃축제, 낙엽축제, 송파문화예술축제 등 다양한 문화행사를 매년 개최함으로써 구민들에게 볼거리?즐길 거리의 제공은 물론 소통과 화합의 통로를 마련해 오고 있습니다.</span></div><div><span style='font-size: 12px;'><br></span></div><div><span style='font-size: 12pt;'>또한 주민들의 문화욕구 충족을 위한 160여 개의 문화예술교양강좌와 우리 역사 바로 알기 사업의 일환으로 지역역사기행 및 서울 5대 궁궐투어를 운영하여 오고 있으며, 매년 향토사료집과 송파문화 책자를 발간하여 지역문화의 역사적 가치를 높이는 한편, 구민들의 문화역량 강화를 위해 서화, 문인, 미술, 사진 등 각종 협회와도 유기적인 협조체제를 유지하고 있습니다.</span></div>",무료,,,,,,,
913.0,문화원,목동운동장,서울특별시 양천구 안양천로 939,37.53050344,126.8816565,02-2640-3805,,https://stadium.seoul.go.kr/reserve/mokdonggr,,"프로축구 일반 5,000원학생?군경 3,000원",연중무휴,,,https://culture.seoul.go.kr/cmmn/file/getImage.do?atchFileId=ATH_SPC_000000000000000000100270&thumb=Y,,"<p>목동종합운동장은 서울의 강북, 강동지역에 편재되어 있는 경기시설을 균형있게 발전시키고, 주요 전문경기외 경기력 향상 촉진 시킬 목적으로 1989년10월 개장되었다. 운동장 시설은 축구장, 야구장 및 실내빙상장이 있으며, 부지내에 테니스장, 실내(실포)사격장을 갖추고 있다.</p><p><br></p><p>[대관 안내]</p><p>이용대상<span style='white-space:pre'>	</span>제한없음</p><p>이용기간<span style='white-space:pre'>	</span>연중수시</p><p>이용시간<span style='white-space:pre'>	</span>하절기(4~9월) : 조기 05:00~08:00, 주간 08:00~19:00, 야간 19:00~05:00 동절기(10~3월) : 조기 06:00~09:00, 주간 09:00~18:00, 야간 18:00~06:00</p><p>접수방법<span style='white-space:pre'>	</span>인터넷/방문</p><p>접수기간<span style='white-space:pre'>	</span>3~6월 대관신청 : 11.1~11.10 7~10월 대관신청 : 3.1~3. 10 11~2월 대관신청 : 7.1~7. 10</p><p>취소기간<span style='white-space:pre'>	</span>예약 확정 전까지</p><p>문의전화<span style='white-space:pre'>	</span>주경기장: 02-2640-3805 야구장: 02-2640-3811 다목적경기장: 02-2640-3818</p><p>선별방법<span style='white-space:pre'>	</span>심사를 거친 후 예약이 완료됩니다.</p><p>이용안내<span style='white-space:pre'>	</span>자세한 문의사항은 담당자에게 문의 바랍니다.</p>",유료,,,,,,,
919.0,문화원,구로문화원,서울특별시 구로구 경인로20가길 38,37.49535812,126.8460358,02-851-0837,02-851-0838,http://www.gurocc.or.kr/main/main.php,,,정보없음,,,https://culture.seoul.go.kr/cmmn/file/getImage.do?atchFileId=14ac6d73bc5f4ba3be7f210cecab694a&thumb=Y,,"<p style='text-align: left;' align='left'><span style='font-size: 12pt;'>구로에 거주하는 문화예술인, 교육인, 향촌사회자, 기업인, 열정적인 구민 등 각계각층의 뜻을 모아 지역사회 개발과 문화진행을 목적으로 2005년 3월 설립되었으며, 순수민간으로 구성된 비영리 특수법인단체로서 지역문화의 보전과 창출, 그리고 구민 여러분의 삶의 질향상을 위해 노력하고 있습니다.</span><br></p>",무료,,,,,,,
934.0,문화원,송파여성문화회관,서울 송파구 백제고분로42길 5 송파여성문화회관,37.50592943,127.1097315,02-2203-3330,02-418-3863,https://www.songpawoman.org/index.asp,,,정보없음,,,https://culture.seoul.go.kr/cmmn/file/getImage.do?atchFileId=248b4c1fd9e44e47b432b00a513ffbfd&thumb=Y,,"<div><span style='font-size: 12pt;'>2001년에 개관한 송파여성문화회관은 ‘행복을 디자인하는 송파여성문화회관’이라는 미션과 ‘참여’, ‘성장’, ‘나눔’이라는 비전 아래 여성들의 삶의 질을 높이고, 자기열정을 실현하며 미래를 준비하는 진보적인 여성들의 삶을 지원하는 기관으로서 역할을 다하고 있습니다.</span></div><div><span style='font-size: 12px;'><br></span></div><div><span style='font-size: 12pt;'>우리 여성문화회관은 여성의 권익 보호와 복지 향상을 위한 문화복지사업, 여성의 취?창업 지원을 위한 능력개발 사업과 동시에 다양한 지역복지 서비스를 운영하고 있습니다.</span></div><div><span style='font-size: 12px;'><br></span></div><div><span style='font-size: 12pt;'>또한 주민의견을 반영한 다채로운 문화강좌 운영을 통해 구민의 문화예술적 참여 확대와 향유를 위해 힘쓰며 성인지, 성평등 교육을 통해 양성평등 의식 향상을 위해 노력하고 있습니다.</span></div><div><span style='font-size: 12px;'><br></span></div><div><span style='font-size: 12pt;'>우리 회관의 전 임직원들은 어떠한 계층도 소외됨이 없이 다가올 미래의 새로운 환경 변화에 능동적으로 대응할 수 있도록 시대적 요구에 부응하는 차별화된 전략으로 구민의 삶에 늘 새로운 변화와 행복을 가져다주는 최고의 문화예술 공간을 만들어나가겠습니다.</span></div>",무료,,,,,,,
943.0,문화원,주한 리스트 헝가리 문화원,서울특별시 중구 명동길 26,37.56345745,126.9837648,02-3789-2106,,https://culture.hu/kor/seoul/aboutus-kor,,0,"매주 토요일, 일요일",,,https://culture.seoul.go.kr/cmmn/file/getImage.do?atchFileId=3fb026d5204e44d583b44504a173ae6f&thumb=Y,,"<span style='font-size: 14pt;'>주한 리스트 헝가리 문화원은, 한국에서 헝가리 예술과 문화의 확산과 교류를 위해 노력하고 있는 문화 기관으로, 다양한 혁신적인 프로그램을 통해 한국인들에게 헝가리의 예술, 음악, 문학, 영화 등 다양한 문화 콘텐츠를 소개하고 있다.</span> ",무료,,,,,,,
986.0,문화원,노원문화의집,서울특별시 노원구 동일로 1530,37.66506609,127.0580236,02-936-3787,02-936-3788,https://www.nwcc.or.kr/main/main.php?categoryid=09&menuid=01&groupid=00,,,"토요일, 일요일, 법정공휴일 휴관",,,https://culture.seoul.go.kr/cmmn/file/getImage.do?atchFileId=9264e1a46c9d4aab81397480945b849f&thumb=Y,,<div style='text-align: left;' align='left'><span style='font-size: 12pt;'>노원문화의 집은 지역주민이 생활권역내에서 다양한 문화예술 정보를 접하고 수준 높은 문화체험과 문화감수성을 증진을 위한 창조적이고 능동적인 복합 문화프로그램 공간을 조성하여 주민의 문화 향상을 도모하기 위하여 개설되었습니다.</span></div>,무료,,,,,,,
1030.0,문화원,무계원,서울 종로구 창의문로5가길 2,37.5918679,126.9634368,02-379-7131~2,02-379-7133,https://www.jfac.or.kr/,09:00 ~ 18:00,무료,"매주 월요일, 1월 1일, 추석 및 설날 연휴",2014-03-20,,https://culture.seoul.go.kr/cmmn/file/getImage.do?atchFileId=ATH_SPC_000000000000000000100893&thumb=Y,"재단법인 종로문화재단에서 운영하는 무계원은 종로구 부암동에 위치한 도심 속 전통문화공간입니다.   세종대왕의 삼남인 안평대군의 별저, 인왕산 자락의 무계정사지(武溪精舍址)에 자리한 무계원은 종로구 익선동의 요정이자 서울시 등록음식점 1호인 오진암(梧珍庵)의 자재를 이축?복원하였습니다.  2014년 개원한 이래 공연, 전시, 강좌, 교육 및 체험 등의 문화 프로그램과 시설별 한옥 대관 사업을 운영하고 있습니다.","<div style='text-align: center;' align='center'><font color='#333333' face='Nanum Gothic, sans-serif'><span style='font-size: 18.6667px;'>도심 속 자연에서 만나는 특별한 전통문화 공간</span></font></div><div style='text-align: center;' align='center'><font color='#333333' face='Nanum Gothic, sans-serif'><span style='font-size: 18.6667px;'><br></span></font></div><div style='text-align: center;' align='center'><font color='#333333' face='Nanum Gothic, sans-serif'><span style='font-size: 18.6667px;'><b>위치</b> 종로구 창의문로 5가길 2 (부암동 327)</span></font></div><div style='text-align: center;' align='center'><font color='#333333' face='Nanum Gothic, sans-serif'><span style='font-size: 18.6667px;'><b>건물형태</b> 한옥 (지하 1층, 지상 1층, 지상 2층) 4개동</span></font></div><div style='text-align: center;' align='center'><font color='#333333' face='Nanum Gothic, sans-serif'><span style='font-size: 18.6667px;'><b>주차공간 </b>없음 (주차관련 사항은 별도 문의하여 주세요. ☎ 02-379-7131~2)</span></font></div>",무료,,,,,,,
1031.0,문화원,금천문화원,서울특별시 금천구 시흥대로38길 61,37.44639673,126.9044447,02-896-8552,02-896-8554,http://geumcheon.kccf.or.kr,,,정보없음,,,https://culture.seoul.go.kr/cmmn/file/getImage.do?atchFileId=c382d0a025d149098bbe1b065f0d5a17&thumb=Y,,<div style='text-align: center;' align='center'><span style='font-size: 14pt;'>금천문화원은 우리지역의 고유문화를 개발하고 보존하며 전승하기 위해 지방문화원 진흥법에 의해 1999년 6월 22일 설립되었습니다.</span></div><div style='text-align: center;' align='center'><span style='font-size: 12px;'><br></span></div><div style='text-align: center;' align='center'><span style='font-size: 14pt;'>그 동안 향토사의 조사연구와 자료를 수집하고 금천문화지를 매년 발간 하였으며 전통문화행사로는 정월대보름 구민척사대회&nbsp;</span></div><div style='text-align: center;' align='center'><span style='font-size: 14pt;'>금천단오민속축제 금천한가위대축제와 금천문화원 수강생들의 뎃생 한국화 서양화 한글서예 한문서예 작품전시회 주부백일장 등을&nbsp;</span></div><div style='text-align: center;' align='center'><span style='font-size: 14pt;'>개최하여 왔습니다.</span></div><div style='text-align: center;' align='center'><span style='font-size: 12px;'><br></span></div><div style='text-align: center;' align='center'><span style='font-size: 14pt;'>또 년 9회 버스 1대로 향토사탐방을 하고 있으며 너무 참여도가 높아 선착순으로 접수하고 있는 실정입니다.</span></div><div style='text-align: center;' align='center'><span style='font-size: 14pt;'>그리고 금천문화학교를 운영하고 있습니다.</span></div><div style='text-align: center;' align='center'><span style='font-size: 14pt;'>현재 12개 교실에서 수강생들이 열심히 배우고 있으며 회원들이 평소 갈고 닦은 기량을 발휘하여 2006년 5월 28일에는 중앙무용&nbsp;</span></div><div style='text-align: center;' align='center'><span style='font-size: 14pt;'>문화연구원이 주최한 제72회 전국무용예술제에서 우리 문화원 전통무용반에서 10 명이 참가하여 금상을 차지하였습니다.</span></div><div style='text-align: center;' align='center'><span style='font-size: 12px;'><br></span></div><div style='text-align: center;' align='center'><span style='font-size: 14pt;'>앞으로도 우리 금천문화원에서는 훌륭한 강사님을 모시고 금천문화학교를 운영해 나가겠습니다.</span></div><div style='text-align: center;' align='center'><span style='font-size: 14pt;'>여러분의 많은 참여를 바랍니다.</span></div>,무료,,,,,,,
